Indicators,Exceeds Expectations,Meets Expectations,Approaches Expectations,Below Expectations
"Use a Kilogram mass to 
measure mass of different 
objects.","Uses a Kilogram mass to 
measure mass of different 
objects accurately and with 
ease.","Uses a Kilogram mass to 
measure mass of different 
objects accurately.","Inconsistently uses a 
Kilogram mass to measure 
mass of different objects.","Little evidence in using a 
Kilogram mass to measure 
mass of different objects."
"Use ½ kg and ¼ kg masses 
to measure mass of 
different objects.","Use ½ kg and ¼ kg masses to 
measure mass of different 
objects accurately and with 
ease.","Use ½ kg and ¼ kg masses 
to measure mass of different 
objects accurately.","Inconsistently uses ½ kg and 
¼ kg masses to measure 
mass of different objects.","Little evidence in using ½ 
kg and ¼ kg masses to 
measure mass of different 
objects."
Add mass in kg.,"Adds mass in kg correctly and 
with ease.",Adds mass in kg correctly.,"Inconsistently adds mass in 
kg.","Little evidence in adding 
mass in kg."
Subtract mass in kg.,"Subtracts mass in kg correctly 
and with ease.","Subtracts mass in kg 
correctly.","Inconsistently subtracts 
mass in kg.","Little evidence subtracting 
mass in kg."
"Use IT devices for learning 
and enjoyment.","Uses IT devices for learning 
and enjoyment fast and 
efficiently.","Uses IT devices for learning 
and enjoyment efficiently.","Inconsistently uses IT 
devices for learning and 
enjoyment.","Little evidence in using IT 
devices for learning and 
enjoyment."
